{"action_owner_actor_id":"0198d6c4-2222-7222-8222-222222222222","action_tier":"T2","action_type":"detection.publish","arguments_digest":"sha256:bbbbbbbbbbbbbbbbbbbbbbbbbbbbbbbbbbbbbbbbbbbbbbbbbbbbbbbbbbbbbbbb","case_id":"0198d6c4-4444-7444-8444-444444444444","contract_version":"1.0.0","credential_class":"detection_writer","credential_reference_digest":"sha256:cccccccccccccccccccccccccccccccccccccccccccccccccccccccccccccccc","exclusion_digests":[],"execution_zone":"connector.elastic","isolation_profile_digest":"sha256:dddddddddddddddddddddddddddddddddddddddddddddddddddddddddddddddd","manifest_id":"0198d6c4-5555-7555-8555-555555555555","manifest_nonce":"AAAAAAAAAAAAAAAAAAAAAAAAAAAAAAAAAAAAAAAAAAA","maximum_use_count":1,"operation":"publish_draft","organization_id":"0198d6c4-1111-7111-8111-111111111111","payload_digest":"sha256:eeeeeeeeeeeeeeeeeeeeeeeeeeeeeeeeeeeeeeeeeeeeeeeeeeeeeeeeeeeeeeee","policy_digest":"sha256:ffffffffffffffffffffffffffffffffffffffffffffffffffffffffffffffff","policy_revision":7,"requestor_actor_id":"0198d6c4-2222-7222-8222-222222222222","roe_digest":null,"rollback_digest":"sha256:aaaaaaaaaaaaaaaaaaaaaaaaaaaaaaaaaaaaaaaaaaaaaaaaaaaaaaaaaaaaaaaa","safety_watch_actor_id":null,"schema_version":"coh.action-manifest/v1","target_digests":["sha256:1111111111111111111111111111111111111111111111111111111111111111"],"tenant_id":"0198d6c4-3333-7333-8333-333333333333","tool":{"digest":"sha256:2222222222222222222222222222222222222222222222222222222222222222","name":"elastic_detection","version":"1.0.0"},"valid_from":"2026-08-25T23:00:00.000000000Z","valid_until":"2026-08-26T00:00:00.000000000Z","workflow_task_id":"0198d6c4-6666-7666-8666-666666666666"}
